{
  "version_contrat": "1.0",
  "request_id": "c1d2e3f4-a5b6-4c7d-8e9f-0a1b2c3d4e5f",
  "fiche_id": "0b8f7e2a-4c1d-4a9b-8e3f-2d6c5b4a3f10",
  "identite": { "domaine": "Guillaume L'Echanson", "cuvee": null, "appellation": "Bourgogne Côte d'Or", "millesime": 2024, "couleur": "rouge", "lwin": null, "ean": null },
  "format_cl": 75,
  "devise": "EUR",
  "forcer": false,
  "date_client": "2026-11-20"
}
